email_text,request_type,sub_request_type
"We are writing to inform you that the interest rate on the Credit Facility has been adjusted from 5.00% to 5.25% per annum, effective December 31, 2024. This adjustment has been made following the central bank's interest rate announcement. Please update your records accordingly. All other terms of the facility remain unchanged. If you have any questions, please let us know. We appreciate your cooperation. Please feel free to contact us with any queries.",Adjustment,
"We are writing to inform you that the interest rate on the Term Loan B has been adjusted from 4.50% to 4.75% per annum, effective March 1, 2025. This adjustment has been made in line with the updated LIBOR replacement. Please update your records accordingly. All other terms of the facility remain unchanged. If you have any questions, please let us know. We appreciate your cooperation. Please feel free to contact us with any queries.",Adjustment,
"Please be advised that the facility fee for the Revolving Credit Facility has been adjusted as of March 31, 2025. The adjustment results in a net adjustment of USD 44153.19 applied. This change is due to an oversight in the previous calculation. We will reflect this adjustment in the next statement. Please let us know if you have any questions. Thank you for your understanding. Please let us know if you have any questions.",Adjustment,
"Please be advised that the commitment fee for the Term Loan A has been adjusted as of Dec 31, 2024. The adjustment results in a refund of USD 25225.41 to the borrower. This change is due to the correction of an error. We will reflect this adjustment in the next statement. Please let us know if you have any questions. Thank you for your understanding. Please let us know if you have any questions.",Adjustment,
"Kindly note that the payment due date for the March 2025 payment has been adjusted from March 1, 2025 to Nov 22, 2024. This adjustment is to accommodate an internal processing delay. No penalties or additional interest will apply due to this change. We have updated the payment schedule accordingly. All stakeholders have been notified accordingly. Thank you for your cooperation.",Adjustment,
"Kindly note that the payment due date for the March 2025 payment has been adjusted from March 1, 2025 to March 8, 2025. This adjustment is to accommodate a local banking holiday. No penalties or additional interest will apply due to this change. We have updated the payment schedule accordingly. All stakeholders have been notified accordingly. Thank you for your cooperation.",Adjustment,
"Pursuant to a recent reconciliation, we have adjusted the principal allocation under the Term Loan B. After reconciliation, Midwest Trust's principal balance is now USD 7324071.95 (previously USD 7599378.32). This correction reflects the accurate funding amounts and has been recorded in our system. Please update your records accordingly. No further action is required from your side at this time. Thank you.",Adjustment,
"Pursuant to a recent reconciliation, we have adjusted the principal allocation under the Loan Facility. After reconciliation, XYZ Capital's principal balance is now USD 8975132.52 (previously USD 9885013.32). This correction reflects the accurate funding amounts and has been recorded in our system. Please update your records accordingly. No further action is required from your side at this time. Thank you.",Adjustment,
"Due to a recalculation of interest for the period Jan 2025, the interest amount on the Term Loan A has been adjusted. The revised interest due is USD 399311.25 instead of USD 401111.00. This adjustment will be reflected in the next payment cycle. Please note this change for your records. We appreciate your attention to this matter. Thank you for your cooperation.",Adjustment,
"Due to a recalculation of interest for the period the last quarter, the interest amount on the Loan Facility has been adjusted. The revised interest due is USD 179805.49 instead of USD 181889.37. This adjustment will be reflected in the next payment cycle. Please note this change for your records. We appreciate your attention to this matter. Thank you for your cooperation.",Adjustment,
"Please be advised that First National Bank has transferred its entire commitment of USD 4099806.19 under the Syndicated Loan Facility to Heritage Bank, effective April 15, 2025. The transfer has been completed in accordance with the Credit Agreement. Please update the lender records accordingly. All parties have been duly informed of this change. No further action is required on your part. Thank you.",AU Transfer,
"Please be advised that Union Bank has transferred its entire commitment of USD 6944977.11 under the Syndicated Loan Facility to Pioneer Bank, effective 30-Nov-2024. The transfer has been completed in accordance with the Credit Agreement. Please update the lender records accordingly. All parties have been duly informed of this change. No further action is required on your part. Thank you.",AU Transfer,
"Union Bank has partially transferred its commitment under the Syndicated Loan Facility to ABC Bank effective October 31, 2024. Union Bank's commitment is reduced to USD 13652134.15 and ABC Bank will assume USD 5015411.83. The Borrower’s consent has been obtained. Please update your records to reflect this change. No further action is required on your part. Thank you. Please let us know if you have any questions.",AU Transfer,
"Eastern Finance Ltd has partially transferred its commitment under the Revolving Credit Facility to Union Bank effective 1-Feb-2025. Eastern Finance Ltd's commitment is reduced to USD 8052160.93 and Union Bank will assume USD 2224666.25. The Borrower’s consent has been obtained. Please update your records to reflect this change. No further action is required on your part. Thank you. Please let us know if you have any questions.",AU Transfer,
"We have received a request from ABC Bank to transfer its entire share of the Syndicated Loan Facility to Midwest Trust. Pursuant to the Credit Agreement, please provide your consent or any objections by Friday, 10-Nov-2024. If no objections are received, the transfer will be effective on May 5, 2025. Thank you for your prompt attention to this matter. Please confirm receipt of this notice.",AU Transfer,
"We have received a request from Pioneer Bank to transfer 25% of its stake of the Revolving Credit Facility to ABC Bank. Pursuant to the Credit Agreement, please provide your consent or any objections by Oct 20, 2024. If no objections are received, the transfer will be effective on May 5, 2025. Thank you for your prompt attention to this matter.",AU Transfer,
"This is to notify you that Heritage Bank and First National Bank have executed an Assignment Agreement for the Syndicated Loan Facility. First National Bank will replace Heritage Bank as a lender for the assigned portion (USD 6735319.03) effective 20-Jan-2025. All relevant parties have been informed. Please update the records accordingly. No further action is required on your part. Thank you.",AU Transfer,
"This is to notify you that Westwood Capital and Midwest Trust have executed an Assignment Agreement for the Term Loan B. Midwest Trust will replace Westwood Capital as a lender for the assigned portion (USD 3233824.45) effective 20-Jan-2025. All relevant parties have been informed. Please update the records accordingly. No further action is required on your part. Thank you. Please let us know if you have any questions.",AU Transfer,
"The Borrower has provided consent for Union Bank to transfer its rights and obligations under the Term Loan A to Midwest Trust. The transfer is scheduled to be effective on Feb 28, 2025, upon execution of the required documents. Kindly update your records once finalized. No further action is required from your side at this time. We appreciate your cooperation in this matter. Thank you.",AU Transfer,
"The Borrower has provided consent for Midwest Trust to transfer its rights and obligations under the Syndicated Loan Facility to Union Bank. The transfer is scheduled to be effective on September 30, 2024, upon execution of the required documents. Kindly update your records once finalized. No further action is required from your side at this time. We appreciate your cooperation in this matter. Thank you.",AU Transfer,
"As part of the closing on December 15, 2024, the allocation of upfront fees has been revised. Midwest Trust will now receive an upfront fee of USD 416320.48 (previously USD 452887.37), and ABC Bank will receive USD 130666.73 (previously USD 149546.74). The total fee pool remains unchanged. Please update your records accordingly. No further action is required on your part. Thank you.",Closing Notice,Reallocation Fees
"Following the final funding allocations at closing, we have adjusted the distribution of the closing fees. Westwood Capital did not fund as initially planned, so its fee portion of USD 163254.27 has been reallocated to the remaining lenders. All affected lenders have been informed of their new fee amounts. Please update your records accordingly. No further action is required on your part. Thank you.",Closing Notice,Reallocation Fees
"At closing, we have reallocated certain fees among the lenders due to final commitment adjustments. The revised fee distribution is provided in the attached schedule. Notably, First National Bank's fee has increased to USD 193136.95, while other fees have been adjusted down proportionally. Kindly review the updated fee allocations and reach out if you have any questions. Thank you for your attention.",Closing Notice,Reallocation Fees
"At closing, we have reallocated certain fees among the lenders due to final commitment adjustments. The revised fee distribution is provided in the attached schedule. Notably, Pioneer Bank's fee has increased to USD 334700.82, while other fees have been adjusted down proportionally. Kindly review the updated fee allocations and reach out if you have any questions. Thank you for your attention.",Closing Notice,Reallocation Fees
"Please note that upon closing of the facility on October 5, 2024, the arrangement fees have been reallocated. This reallocation reflects changes in the lender group composition. For example, Union Bank’s share of the fee is now 30%, up from 20%. These adjustments have been agreed upon by all parties. If you require further details, please let us know. Please let us know if you have any questions.",Closing Notice,Reallocation Fees
"Please note that upon closing of the facility on Sep 28, 2024, the arrangement fees have been reallocated. This reallocation reflects changes in the lender group composition. For example, Union Bank’s share of the fee is now 35%, up from 25%. These adjustments have been agreed upon by all parties. If you require further details, please let us know. Please let us know if you have any questions.",Closing Notice,Reallocation Fees
"Following the final funding allocations at closing, we have adjusted the distribution of the closing fees. Union Bank did not fund as initially planned, so its fee portion of USD 53496.45 has been reallocated to the remaining lenders. All affected lenders have been informed of their new fee amounts. Please update your records accordingly. No further action is required on your part. Thank you.",Closing Notice,Reallocation Fees
"Following the final funding allocations at closing, we have adjusted the distribution of the closing fees. Union Bank did not fund as initially planned, so its fee portion of USD 83947.52 has been reallocated to the remaining lenders. All affected lenders have been informed of their new fee amounts. Please update your records accordingly. No further action is required on your part. Thank you.",Closing Notice,Reallocation Fees
"We are writing to inform you that closing fees for the transaction have been reallocated as of March 30, 2025. The total fees remain the same, but each lender’s portion has changed based on final commitments. This change ensures each lender receives the correct fee amount. No action is required from your end; this is for your records. Thank you.",Closing Notice,Reallocation Fees
"We are writing to inform you that closing fees for the transaction have been reallocated as of Jan 31, 2025. The total fees remain the same, but each lender’s portion has changed based on final commitments. This change ensures each lender receives the correct fee amount. No action is required from your end; this is for your records. Thank you.",Closing Notice,Reallocation Fees
"We are pleased to inform you that the amendment to the Credit Agreement became effective on June 30, 2024. Pursuant to the amendment, an amendment fee of 0.5% of each Lender’s commitment is now payable to all consenting Lenders. We will arrange for the distribution of these fees to the entitled Lenders. Please let us know if you have any questions.",Closing Notice,Amendment Fees
"We are pleased to inform you that the amendment to the Credit Agreement became effective on Sep 15, 2024. Pursuant to the amendment, an amendment fee of 1.0% of each Lender’s commitment is now payable to all consenting Lenders. We will arrange for the distribution of these fees to the entitled Lenders. Please let us know if you have any questions.",Closing Notice,Amendment Fees
"As the amendment closing has occurred on March 1, 2025, an amendment fee has been applied. Each consenting Lender will receive a fee of USD 282627.23 (equivalent to 1.0% of their respective commitments). The total amendment fee has been funded by the Borrower today. Kindly update your records to reflect the fee payment. Thank you. Please contact us if you have any questions regarding this fee.",Closing Notice,Amendment Fees
"As the amendment closing has occurred on Nov 10, 2024, an amendment fee has been applied. Each consenting Lender will receive a fee of USD 688675.28 (equivalent to 2.0% of their respective commitments). The total amendment fee has been funded by the Borrower today. Kindly update your records to reflect the fee payment. Thank you. Please contact us if you have any questions regarding this fee.",Closing Notice,Amendment Fees
"Please note that an amendment fee of USD 10.00 per USD 1,000 of commitment (approximately 1.0%) was due upon the effectiveness of the recent amendment on Aug 1, 2024. This fee will be paid to all Lenders who consented to the amendment. No action is required on your part. We appreciate your attention to this update. Please let us know if you have any questions.",Closing Notice,Amendment Fees
"Please note that an amendment fee of USD 5.00 per USD 1,000 of commitment (approximately 0.5%) was due upon the effectiveness of the recent amendment on January 15, 2025. This fee will be paid to all Lenders who consented to the amendment. No action is required on your part. We appreciate your attention to this update. Please let us know if you have any questions.",Closing Notice,Amendment Fees
"Following the successful execution of the amendment dated May 15, 2025, the Borrower is required to pay an amendment fee to the Lenders. The fee has been calculated as 1.5% of each consenting Lender’s commitment. We will credit each Lender’s account with their respective fee upon receipt of funds from the Borrower. If you need further details, please contact us.",Closing Notice,Amendment Fees
"Following the successful execution of the amendment dated February 28, 2025, the Borrower is required to pay an amendment fee to the Lenders. The fee has been calculated as 2.0% of each consenting Lender’s commitment. We will credit each Lender’s account with their respective fee upon receipt of funds from the Borrower. If you need further details, please contact us.",Closing Notice,Amendment Fees
"This is a closing notice for the amendment fees associated with the amendment effective December 31, 2024. The amendment fee pool totals USD 1947040.88, which will be distributed to consenting Lenders pro rata. Each Lender’s portion corresponds to 1.5% of their final commitment. We have updated the records to reflect these fees. Thank you.",Closing Notice,Amendment Fees
"This is a closing notice for the amendment fees associated with the amendment effective July 15, 2024. The amendment fee pool totals USD 1224857.27, which will be distributed to consenting Lenders pro rata. Each Lender’s portion corresponds to 1.0% of their final commitment. We have updated the records to reflect these fees. Thank you.",Closing Notice,Amendment Fees
"Due to final lender participation changes at closing, the principal allocations have been reallocated. First National Bank's funded principal is now USD 14936139.72 (was USD 15954877.39), and Union Bank's is now USD 16608370.31 (was USD 17598457.24). The overall funded amount remains the same. Kindly update your records to reflect this final allocation. Thank you. Please let us know if you have any questions.",Closing Notice,Reallocation Principal
"Due to final lender participation changes at closing, the principal allocations have been reallocated. Pioneer Bank's funded principal is now USD 14812631.99 (was USD 15101924.19), and Heritage Bank's is now USD 13645831.20 (was USD 14142816.48). The overall funded amount remains the same. Kindly update your records to reflect this final allocation. Thank you. Please let us know if you have any questions.",Closing Notice,Reallocation Principal
"At closing, the Borrower reallocated principal amounts between the facilities. An amount of USD 14774793.39 has been shifted from Revolver to Term Loan A. This reallocation was done to optimize the use of proceeds. The total principal outstanding remains unchanged. Please adjust the records for each facility accordingly. Please let us know if you have any questions. Thank you for your cooperation.",Closing Notice,Reallocation Principal
"At closing, the Borrower reallocated principal amounts between the facilities. An amount of USD 6079141.21 has been shifted from Revolving Credit Facility to Term Loan A. This reallocation was done to optimize the use of proceeds. The total principal outstanding remains unchanged. Please adjust the records for each facility accordingly. Please let us know if you have any questions. Thank you for your cooperation.",Closing Notice,Reallocation Principal
"Please be advised that as part of the closing adjustments on August 31, 2024, the distribution of principal among lenders has been modified. The attached schedule outlines the new principal breakdown per lender. These changes ensure each lender’s funded amount aligns with the final commitments. No further action is required on your part. Please let us know if you have any questions.",Closing Notice,Reallocation Principal
"Please be advised that as part of the closing adjustments on Nov 15, 2024, the distribution of principal among lenders has been modified. The attached schedule outlines the new principal breakdown per lender. These changes ensure each lender’s funded amount aligns with the final commitments. No further action is required on your part. Please let us know if you have any questions.",Closing Notice,Reallocation Principal
"Following the closing of the transaction, the principal has been reallocated between Revolver and Facility Y. Revolver now has an outstanding principal of USD 39078936.40, and Facility Y has USD 15024577.31. This adjustment reflects the final structure of the deal. We have updated our records accordingly. Please let us know if you have any questions. No further action is required on your part. Thank you for your cooperation.",Closing Notice,Reallocation Principal
"Following the closing of the transaction, the principal has been reallocated between Facility Y and Facility X. Facility Y now has an outstanding principal of USD 11087193.17, and Facility X has USD 21641748.18. This adjustment reflects the final structure of the deal. We have updated our records accordingly. Please let us know if you have any questions. No further action is required on your part. Thank you for your cooperation.",Closing Notice,Reallocation Principal
"We are writing to notify you that principal amounts were reallocated at closing. Because ABC Bank reduced its funding at closing, USD 8485636.36 of the loan proceeds originally allocated to that lender have been reassigned to other lenders. All participants have agreed to this change. Kindly update any records or systems to reflect the revised principal allocation. Thank you for your cooperation. Please let us know if you have any questions.",Closing Notice,Reallocation Principal
"We are writing to notify you that principal amounts were reallocated at closing. Because the Borrower adjusted allocations at closing, USD 8177988.41 of the loan proceeds originally allocated to Facility A have been reassigned to Term Loan A. All participants have agreed to this change. Kindly update any records or systems to reflect the revised principal allocation. Thank you for your cooperation. Please let us know if you have any questions.",Closing Notice,Reallocation Principal
"As part of the refinancing effective October 1, 2024, your existing commitment of USD 10114972.81 under Facility A has been rolled into a new Term Loan B on a cashless basis. No physical funding or repayment will be required for this rollover. All terms of the new facility will apply to the rolled amount. Please update your records to reflect this change.",Commitment Change,Cashless Roll
"As part of the refinancing effective Jan 15, 2025, your existing commitment of USD 8104128.41 under Facility A has been rolled into a new Term Loan B on a cashless basis. No physical funding or repayment will be required for this rollover. All terms of the new facility will apply to the rolled amount. Please update your records to reflect this change.",Commitment Change,Cashless Roll
"As agreed, a cashless roll of the outstanding commitments has been executed on December 1, 2024. XYZ Capital's entire commitment under the original facility has been transferred to the new facility without any cash exchange. The transition was seamless and the new facility is now in effect. No further action is needed from your end; this is for your information. Thank you.",Commitment Change,Cashless Roll
"As agreed, a cashless roll of the outstanding commitments has been executed on June 30, 2024. Heritage Bank's entire commitment under the original facility has been transferred to the new facility without any cash exchange. The transition was seamless and the new facility is now in effect. No further action is needed from your end; this is for your information. Thank you.",Commitment Change,Cashless Roll
"Please note that effective July 31, 2024, the commitments have been rolled over on a cashless basis from Term Loan X to a new facility. The Borrower did not make a cash repayment; instead, the principal continues under the new terms. We have updated the lender register accordingly. If you have any questions regarding this cashless roll, please let us know. Thank you.",Commitment Change,Cashless Roll
"Please note that effective November 30, 2024, the commitments have been rolled over on a cashless basis from Tranche A to a new facility. The Borrower did not make a cash repayment; instead, the principal continues under the new terms. We have updated the lender register accordingly. If you have any questions regarding this cashless roll, please let us know. Thank you.",Commitment Change,Cashless Roll
"Pursuant to the amendment, we have implemented a cashless roll of Westwood Capital's commitment. USD 7170277.29, previously held under Facility A, is now carried over to the new facility as of September 15, 2024. There were no funds exchanged in this process. Kindly update your records to reflect Westwood Capital's commitment under the new facility. Thank you for your cooperation.",Commitment Change,Cashless Roll
"Pursuant to the amendment, we have implemented a cashless roll of Pioneer Bank's commitment. USD 7559349.72, previously held under Facility A, is now carried over to Facility B as of April 30, 2025. There were no funds exchanged in this process. Kindly update your records to reflect Pioneer Bank's commitment under the new facility. Thank you for your cooperation.",Commitment Change,Cashless Roll
"This email serves as confirmation of the cashless roll completed on August 1, 2024. All existing commitments under the prior facility were rolled into the new tranche under the 2024 Facility without any cash settlement. Lenders maintain their same principal amounts now under the new facility. We appreciate your cooperation during this transition. Please let us know if you have any questions.",Commitment Change,Cashless Roll
"This email serves as confirmation of the cashless roll completed on December 31, 2024. All existing commitments under the 2019 Facility were rolled into the new tranche under the new extended facility without any cash settlement. Lenders maintain their same principal amounts now under the new facility. We appreciate your cooperation during this transition. Please let us know if you have any questions.",Commitment Change,Cashless Roll
"We have received a notice from the Borrower to reduce the commitment under the Revolving Credit Facility by USD 9058518.44 effective September 30, 2024. Upon this decrease, the total commitment will be USD 54624789.20. Please update your records to reflect the reduced commitment. Kindly note that all lenders’ shares will be reduced proportionally. Please let us know if you have any questions.",Commitment Change,Decrease
